{
  "schema_version": "1",
  "answer": "The retry budget is three attempts with exponential backoff, per the runbook.",
  "facts": ["retry budget is three attempts"],
  "citations": [
    {
      "id": "runbook/retries",
      "supports": ["retry budget is three attempts"]
    }
  ],
  "abstained": false,
  "trajectory": [
    {"seq": 1, "tool": "corpus.search", "action": "locate the retry runbook"},
    {"seq": 2, "tool": "corpus.read", "action": "read the retry budget section"}
  ],
  "metrics": {"latency_ms": 2400, "cost_usd": 0.0},
  "metadata": {
    "harness": "fixture",
    "candidate_version": "provenance-v1",
    "profile": "worker-fast",
    "engine": "llama.cpp@b2497f88",
    "artifact_sha256": "3f9c2b7a1e4d8065c3a5f27b90de14683cb27a5f0e9d4c1b8a6f30d275e4b9c1"
  }
}
